paperId,venue_key,title,year,url,embedding_alignment,outlier_side,low_threshold,high_threshold
77a7d06086f4db641a88eb2b998ba400e3356fa3,tpami,Group Sampling for Scale Invariant Face Detection,2020,https://www.semanticscholar.org/paper/77a7d06086f4db641a88eb2b998ba400e3356fa3,0.45230332,high,0.18802278041839598,0.44897501915693283
2417c2ab87e85eb8a8fdac0edfd70362e7594690,tpami,Gating Revisited: Deep Multi-Layer RNNs That can be Trained,2019,https://www.semanticscholar.org/paper/2417c2ab87e85eb8a8fdac0edfd70362e7594690,0.1297268,low,0.18802278041839598,0.44897501915693283
47e48c7c36d4e5ddc9d737e3ed894092da27b66f,tpami,SEEM: A Sequence Entropy Energy-Based Model for Pedestrian Trajectory All-Then-One Prediction,2022,https://www.semanticscholar.org/paper/47e48c7c36d4e5ddc9d737e3ed894092da27b66f,0.18295941,low,0.18802278041839598,0.44897501915693283
80aa557a6abd7d30d006ecaceaeeee0444b194bd,tpami,Revisit Weakly Supervised Hashing With Deep Multi-Modal Foundation Models,2025,https://www.semanticscholar.org/paper/80aa557a6abd7d30d006ecaceaeeee0444b194bd,0.4819104,high,0.18802278041839598,0.44897501915693283
db164c3b616ef7f938b1e54b83f50dcba3fa4ff5,tpami,Hierarchical Attention-Based Age Estimation and Bias Analysis,2021,https://www.semanticscholar.org/paper/db164c3b616ef7f938b1e54b83f50dcba3fa4ff5,0.18180099,low,0.18802278041839598,0.44897501915693283
2319de67da16076b0764f2f0d1b8db370a176132,tpami,Attention Weighted Local Descriptors,2023,https://www.semanticscholar.org/paper/2319de67da16076b0764f2f0d1b8db370a176132,0.4903759,high,0.18802278041839598,0.44897501915693283
6eec269c6fb1393788a440652b05810063bdea3c,tpami,"On the Correlation Among Edge, Pose and Parsing",2021,https://www.semanticscholar.org/paper/6eec269c6fb1393788a440652b05810063bdea3c,0.4751264,high,0.18802278041839598,0.44897501915693283
7cc7782b0d4b5c28451f47ecb335a20d5162beb6,tpami,Improving Machine Vision Using Human Perceptual Representations: The Case of Planar Reflection Symmetry for Object Classification,2020,https://www.semanticscholar.org/paper/7cc7782b0d4b5c28451f47ecb335a20d5162beb6,0.4499942,high,0.18802278041839598,0.44897501915693283
97f88ff1924a687365fd86850eca1af784f17788,tpami,Depth Sensing by Near-Infrared Light Absorption in Water,2020,https://www.semanticscholar.org/paper/97f88ff1924a687365fd86850eca1af784f17788,0.14587116,low,0.18802278041839598,0.44897501915693283
d080d31350c88a5410a3f475277b931afeaf6665,tpami,Fixed Points of Belief Propagation—An Analysis via Polynomial Homotopy Continuation,2016,https://www.semanticscholar.org/paper/d080d31350c88a5410a3f475277b931afeaf6665,0.12107608,low,0.18802278041839598,0.44897501915693283
2e044e4478ebac4ce58cef0a6ff8815b2c9fb02d,tpami,Revisiting Essential and Nonessential Settings of Evidential Deep Learning,2024,https://www.semanticscholar.org/paper/2e044e4478ebac4ce58cef0a6ff8815b2c9fb02d,0.17946067,low,0.18802278041839598,0.44897501915693283
ebc5dc2961d12cbbbd45264889dfc3ef9731fc6a,tpami,Human Action Recognition From Various Data Modalities: A Review,2020,https://www.semanticscholar.org/paper/ebc5dc2961d12cbbbd45264889dfc3ef9731fc6a,0.47105956,high,0.18802278041839598,0.44897501915693283
18fb5c662252d685652ec72d508531ae7bb739b5,tpami,Learning Optimal Wavefront Shaping for Multi-Channel Imaging,2021,https://www.semanticscholar.org/paper/18fb5c662252d685652ec72d508531ae7bb739b5,0.16776982,low,0.18802278041839598,0.44897501915693283
a7c79c71f83792595c07300a8a51487de12aa2f4,tpami,Deep Learning with Data Privacy via Residual Perturbation,2024,https://www.semanticscholar.org/paper/a7c79c71f83792595c07300a8a51487de12aa2f4,0.066502124,low,0.18802278041839598,0.44897501915693283
fe3187ef8ad0576caf8982f049e5906f92f67230,tpami,Property-Aware Relation Networks for Few-Shot Molecular Property Prediction,2021,https://www.semanticscholar.org/paper/fe3187ef8ad0576caf8982f049e5906f92f67230,0.17640862,low,0.18802278041839598,0.44897501915693283
4f5661d1c99f2689cdf39de4701aa60021794811,tpami,Flare7K++: Mixing Synthetic and Real Datasets for Nighttime Flare Removal and Beyond,2023,https://www.semanticscholar.org/paper/4f5661d1c99f2689cdf39de4701aa60021794811,0.111517474,low,0.18802278041839598,0.44897501915693283
66e6698a2ef35b5c9c880d5ca4356fa87dde62d9,tpami,BadLabel: A Robust Perspective on Evaluating and Enhancing Label-Noise Learning,2023,https://www.semanticscholar.org/paper/66e6698a2ef35b5c9c880d5ca4356fa87dde62d9,0.18499559,low,0.18802278041839598,0.44897501915693283
04cb96e55e787489a1c6c2df68cfd54a4cbac384,tpami,Poisoning Attack Against Estimating From Pairwise Comparisons,2021,https://www.semanticscholar.org/paper/04cb96e55e787489a1c6c2df68cfd54a4cbac384,0.08080727,low,0.18802278041839598,0.44897501915693283
5f9ca5ce7f7e5bb6e75cb6020acd98ab37971afd,tpami,Online Attention Accumulation for Weakly Supervised Semantic Segmentation,2021,https://www.semanticscholar.org/paper/5f9ca5ce7f7e5bb6e75cb6020acd98ab37971afd,0.46056396,high,0.18802278041839598,0.44897501915693283
08220286e251d496c6cd9c942a594dcaeb25c388,tpami,Small-Object Sensitive Segmentation Using Across Feature Map Attention,2022,https://www.semanticscholar.org/paper/08220286e251d496c6cd9c942a594dcaeb25c388,0.48200506,high,0.18802278041839598,0.44897501915693283
5430f958489c1f3d5d92317fb7f36f29b9c0414e,tpami,Towards Effective Causal Partitioning by Edge Cutting of Adjoint Graph,2024,https://www.semanticscholar.org/paper/5430f958489c1f3d5d92317fb7f36f29b9c0414e,0.12845142,low,0.18802278041839598,0.44897501915693283
24edc048d8da0c1d4165b5f44ce97672f96c5fd5,tpami,Semi-Infinitely Constrained Markov Decision Processes and Provably Efficient Reinforcement Learning,2024,https://www.semanticscholar.org/paper/24edc048d8da0c1d4165b5f44ce97672f96c5fd5,0.1879755,low,0.18802278041839598,0.44897501915693283
1470ddc1c0de320ecce727cf446ad99505e7a02e,tpami,Non-Rigid Shape From Water,2021,https://www.semanticscholar.org/paper/1470ddc1c0de320ecce727cf446ad99505e7a02e,0.15579736,low,0.18802278041839598,0.44897501915693283
af54b730d31d3941043abde92565b30ace9e702b,tpami,Rainbow UDA: Combining Domain Adaptive Models for Semantic Segmentation Tasks,2023,https://www.semanticscholar.org/paper/af54b730d31d3941043abde92565b30ace9e702b,0.13187903,low,0.18802278041839598,0.44897501915693283
b838395165ee6306b5a60e19e9a3422e21d55833,tpami,Imperceptible Transfer Attack and Defense on 3D Point Cloud Classification,2021,https://www.semanticscholar.org/paper/b838395165ee6306b5a60e19e9a3422e21d55833,0.1854783,low,0.18802278041839598,0.44897501915693283
6d82350cf2b928b7432ae990ce80f030dedcbccb,tpami,"PS<inline-formula><tex-math notation=""LaTeX"">$^{2}$</tex-math><alternatives><mml:math><mml:msup><mml:mrow/><mml:mn>2</mml:mn></mml:msup></mml:math><inline-graphic xlink:href=""ghanekar-ieq1-3202511.gif""/></alternatives></inline-formula> F: Polarized Spiral Point Spread Function for Single-Shot 3D Sen",2022,https://www.semanticscholar.org/paper/6d82350cf2b928b7432ae990ce80f030dedcbccb,0.17394081,low,0.18802278041839598,0.44897501915693283
ecd2ee3175f8ddad6385dfc6b2bf5e4647de2c5c,tpami,Fair Clustering Ensemble With Equal Cluster Capacity,2024,https://www.semanticscholar.org/paper/ecd2ee3175f8ddad6385dfc6b2bf5e4647de2c5c,0.16949782,low,0.18802278041839598,0.44897501915693283
155a42564425c4ad9217bc987db4aef4fc2f52f4,tpami,Multi-Language Online Handwriting Recognition,2017,https://www.semanticscholar.org/paper/155a42564425c4ad9217bc987db4aef4fc2f52f4,0.4575711,high,0.18802278041839598,0.44897501915693283
180a77abd5c5a4ae988145c625eca1037bad8c75,tpami,Submodular Relaxation for Inference in Markov Random Fields,2015,https://www.semanticscholar.org/paper/180a77abd5c5a4ae988145c625eca1037bad8c75,0.16027604,low,0.18802278041839598,0.44897501915693283
aef2f43fcc1d5cb11e7db66bab368de28160b8a8,tpami,"TransFace++: Rethinking the Face Recognition Paradigm With a Focus on Accuracy, Efficiency, and Security",2023,https://www.semanticscholar.org/paper/aef2f43fcc1d5cb11e7db66bab368de28160b8a8,0.46782023,high,0.18802278041839598,0.44897501915693283
125e45af77cbec076dcf379b55c682595ac2dd88,tpami,RED++ : Data-Free Pruning of Deep Neural Networks via Input Splitting and Output Merging,2021,https://www.semanticscholar.org/paper/125e45af77cbec076dcf379b55c682595ac2dd88,0.14781076,low,0.18802278041839598,0.44897501915693283
beb02d252a6018e088ed0faf69342b6a4a95d077,tpami,A Multi-Level Interpretable Sleep Stage Scoring System by Infusing Experts’ Knowledge Into a Deep Network Architecture,2022,https://www.semanticscholar.org/paper/beb02d252a6018e088ed0faf69342b6a4a95d077,0.48267,high,0.18802278041839598,0.44897501915693283
9ebd68585193e67976bc92c9489290796fe4d93b,tpami,Personalized Latent Structure Learning for Recommendation,2023,https://www.semanticscholar.org/paper/9ebd68585193e67976bc92c9489290796fe4d93b,0.13928154,low,0.18802278041839598,0.44897501915693283
758ec7a4e0448264e5797c63afacc36fabf8857b,tpami,Salient Object Detection via Integrity Learning,2021,https://www.semanticscholar.org/paper/758ec7a4e0448264e5797c63afacc36fabf8857b,0.4507283,high,0.18802278041839598,0.44897501915693283
4f816033e00b436c9e241cb2580873aff5786704,tpami,Max-Margin Majority Voting for Learning from Crowds,2019,https://www.semanticscholar.org/paper/4f816033e00b436c9e241cb2580873aff5786704,0.14441803,low,0.18802278041839598,0.44897501915693283
5a5988f5c885c56bb20ba0c7bc6b3692ffb6a8aa,tpami,Toward Understanding the Generalizability of Delayed Stochastic Gradient Descent,2023,https://www.semanticscholar.org/paper/5a5988f5c885c56bb20ba0c7bc6b3692ffb6a8aa,0.15674734,low,0.18802278041839598,0.44897501915693283
b78a9007186f8db25e1890757959b5b0513e220c,tpami,"A Survey on Open-Vocabulary Detection and Segmentation: Past, Present, and Future",2023,https://www.semanticscholar.org/paper/b78a9007186f8db25e1890757959b5b0513e220c,0.47289538,high,0.18802278041839598,0.44897501915693283
32524a5cafd84036ed3708bd6e7bbe3f39bd7302,tpami,Sparse Non-Local CRF With Applications,2024,https://www.semanticscholar.org/paper/32524a5cafd84036ed3708bd6e7bbe3f39bd7302,0.17710535,low,0.18802278041839598,0.44897501915693283
80d7dacececb366dabcbcab592420b6dc93da066,tpami,Signed Graph Metric Learning via Gershgorin Disc Perfect Alignment,2020,https://www.semanticscholar.org/paper/80d7dacececb366dabcbcab592420b6dc93da066,0.17245036,low,0.18802278041839598,0.44897501915693283
7c0923b6f7ecc866ef16198e43400a199fa74e62,tpami,Image Feature Information Extraction for Interest Point Detection: A Comprehensive Review,2022,https://www.semanticscholar.org/paper/7c0923b6f7ecc866ef16198e43400a199fa74e62,0.49360606,high,0.18802278041839598,0.44897501915693283
0c01ce5fdd671fbc0ebf04fe64b4ee4f9f4befe3,tpami,Tensor Coupled Learning of Incomplete Longitudinal Features and Labels for Clinical Score Regression,2024,https://www.semanticscholar.org/paper/0c01ce5fdd671fbc0ebf04fe64b4ee4f9f4befe3,0.17824663,low,0.18802278041839598,0.44897501915693283
8abf85f26dfd202e3a54ebb23ebf7b4aace6fbc2,tpami,CCNet: Criss-Cross Attention for Semantic Segmentation,2018,https://www.semanticscholar.org/paper/8abf85f26dfd202e3a54ebb23ebf7b4aace6fbc2,0.47666177,high,0.18802278041839598,0.44897501915693283
4e2e782126fb4015c25897ad631e7ba2b893f54f,tpami,Unifying Fourteen Post-Hoc Attribution Methods With Taylor Interactions,2024,https://www.semanticscholar.org/paper/4e2e782126fb4015c25897ad631e7ba2b893f54f,0.14383791,low,0.18802278041839598,0.44897501915693283
ed447e4f6399e8605c977a17dd7e1a477f11b4fe,tpami,Anthropomorphic Features for On-Line Signatures,2019,https://www.semanticscholar.org/paper/ed447e4f6399e8605c977a17dd7e1a477f11b4fe,0.47313994,high,0.18802278041839598,0.44897501915693283
2a35ba870fd7c61da52ae7b87e339bacb1b5dd86,tpami,Batch Reinforcement Learning With a Nonparametric Off-Policy Policy Gradient,2020,https://www.semanticscholar.org/paper/2a35ba870fd7c61da52ae7b87e339bacb1b5dd86,0.17004044,low,0.18802278041839598,0.44897501915693283
288802c80ba8592a70eec7e125c5879a71639651,tpami,FedID: Enhancing Federated Learning Security Through Dynamic Identification,2025,https://www.semanticscholar.org/paper/288802c80ba8592a70eec7e125c5879a71639651,0.13770336,low,0.18802278041839598,0.44897501915693283
79609991d734596527ff5e8c3930bc9cd3972684,tpami,Vision-Centric BEV Perception: A Survey,2022,https://www.semanticscholar.org/paper/79609991d734596527ff5e8c3930bc9cd3972684,0.47727755,high,0.18802278041839598,0.44897501915693283
1ea574c5311ae0aebf99cd000d23effdc709a945,tpami,"SimVODIS: Simultaneous Visual Odometry, Object Detection, and Instance Segmentation",2019,https://www.semanticscholar.org/paper/1ea574c5311ae0aebf99cd000d23effdc709a945,0.48153445,high,0.18802278041839598,0.44897501915693283
e0962f83e2daa04d2a485f43c655a59bfb2d11bb,tpami,Guest Editorial: The Computational Face,2018,https://www.semanticscholar.org/paper/e0962f83e2daa04d2a485f43c655a59bfb2d11bb,0.6653186,high,0.18802278041839598,0.44897501915693283
2a8c90f81e8eb575be6bd5f412e53a33acaf0cd7,tpami,OANet: Learning Two-View Correspondences and Geometry Using Order-Aware Network,2020,https://www.semanticscholar.org/paper/2a8c90f81e8eb575be6bd5f412e53a33acaf0cd7,0.46027935,high,0.18802278041839598,0.44897501915693283
687843157b19e750d03e078c3807667c7261a99c,tpami,A Review of Deep Learning for Video Captioning,2023,https://www.semanticscholar.org/paper/687843157b19e750d03e078c3807667c7261a99c,0.4490213,high,0.18802278041839598,0.44897501915693283
7f7d45a2a57749dd1ff43ee0fbc9bea2b0685235,tpami,Robust Low-Tubal-Rank Tensor Recovery From Binary Measurements,2021,https://www.semanticscholar.org/paper/7f7d45a2a57749dd1ff43ee0fbc9bea2b0685235,0.16145186,low,0.18802278041839598,0.44897501915693283
973bdba5494169822cb4a5cbf26feac5a206f7ca,tpami,Exploring the Vulnerabilities of Federated Learning: A Deep Dive into Gradient Inversion Attacks,2025,https://www.semanticscholar.org/paper/973bdba5494169822cb4a5cbf26feac5a206f7ca,0.13430253,low,0.18802278041839598,0.44897501915693283
833390b9c94e7af965bba6bdde6ca59a873e61da,tpami,Parameter-Inverted Image Pyramid Networks for Visual Perception and Multimodal Understanding,2025,https://www.semanticscholar.org/paper/833390b9c94e7af965bba6bdde6ca59a873e61da,0.45202953,high,0.18802278041839598,0.44897501915693283
85fca9771eb00e55c190885a580b0fef078f9deb,tpami,Tasks Integrated Networks: Joint Detection and Retrieval for Image Search,2020,https://www.semanticscholar.org/paper/85fca9771eb00e55c190885a580b0fef078f9deb,0.5132243,high,0.18802278041839598,0.44897501915693283
c4f37fa1258f6e45d690265f7e8590e0aa17273e,tpami,On the Latent Variable Interpretation in Sum-Product Networks,2016,https://www.semanticscholar.org/paper/c4f37fa1258f6e45d690265f7e8590e0aa17273e,0.1876181,low,0.18802278041839598,0.44897501915693283
1308983966fa265e14f237eadf2e674d1f223a6f,tpami,A Very Simple Safe-Bayesian Random Forest,2015,https://www.semanticscholar.org/paper/1308983966fa265e14f237eadf2e674d1f223a6f,0.1728968,low,0.18802278041839598,0.44897501915693283
690df0820f35a47e1ce44f90e6ddb4132aa09267,tpami,Vision-Language Models for Vision Tasks: A Survey,2023,https://www.semanticscholar.org/paper/690df0820f35a47e1ce44f90e6ddb4132aa09267,0.46785513,high,0.18802278041839598,0.44897501915693283
1c83f3f9789df43bf937ae2618721e2da83dcc06,tpami,From Show to Tell: A Survey on Deep Learning-Based Image Captioning,2021,https://www.semanticscholar.org/paper/1c83f3f9789df43bf937ae2618721e2da83dcc06,0.49299416,high,0.18802278041839598,0.44897501915693283
5716cca7f1ee14064a9a923bfe6e6e0698430ce8,tpami,Towards Reliable and Faithful Explanations: A Disentanglement-Augmented Approach for Selective Rationalization,2025,https://www.semanticscholar.org/paper/5716cca7f1ee14064a9a923bfe6e6e0698430ce8,0.18794642,low,0.18802278041839598,0.44897501915693283
5b1553a4b98babc091cd4a6cbfb51d528815ac70,tpami,IntPhys 2019: A Benchmark for Visual Intuitive Physics Understanding,2018,https://www.semanticscholar.org/paper/5b1553a4b98babc091cd4a6cbfb51d528815ac70,0.46590182,high,0.18802278041839598,0.44897501915693283
0e78fb6966d776299e90c26646ad3a61c13b857d,tpami,Depth and Video Segmentation Based Visual Attention for Embodied Question Answering,2022,https://www.semanticscholar.org/paper/0e78fb6966d776299e90c26646ad3a61c13b857d,0.46302247,high,0.18802278041839598,0.44897501915693283
f7ccb9ea1d55dc0085e48d6d6615c356cc2d4155,tpami,Guest Editors' Introduction to the Special Section on Computational Photography,2020,https://www.semanticscholar.org/paper/f7ccb9ea1d55dc0085e48d6d6615c356cc2d4155,0.48595822,high,0.18802278041839598,0.44897501915693283
63007863047c76e2730f38c79a7b38f388b18b80,tpami,A Variational Bayesian Inference Theory of Elasticity and Its Mixed Probabilistic Finite Element Method for Inverse Deformation Solutions in Any Dimension,2024,https://www.semanticscholar.org/paper/63007863047c76e2730f38c79a7b38f388b18b80,0.14909491,low,0.18802278041839598,0.44897501915693283
e8a2c8c2cedfeb64e7c0ec1a5ce7225e424f78d3,tpami,Deeper Insights Into Deep Graph Convolutional Networks: Stability and Generalization,2024,https://www.semanticscholar.org/paper/e8a2c8c2cedfeb64e7c0ec1a5ce7225e424f78d3,0.17199722,low,0.18802278041839598,0.44897501915693283
3e8392484f3900c54fdfb66c17c79e7a1dd49ac2,tpami,Deep Feature Space: A Geometrical Perspective,2020,https://www.semanticscholar.org/paper/3e8392484f3900c54fdfb66c17c79e7a1dd49ac2,0.5140532,high,0.18802278041839598,0.44897501915693283
9883759eb90c2aff373b48d31d3e5700b3bd256a,tpami,Motion Segmentation & Multiple Object Tracking by Correlation Co-Clustering,2020,https://www.semanticscholar.org/paper/9883759eb90c2aff373b48d31d3e5700b3bd256a,0.50114334,high,0.18802278041839598,0.44897501915693283
82d9b588eabeb6bf4baa945d5c71b3bf89dd1e69,tpami,BreakingNews: Article Annotation by Image and Text Processing,2016,https://www.semanticscholar.org/paper/82d9b588eabeb6bf4baa945d5c71b3bf89dd1e69,0.4983812,high,0.18802278041839598,0.44897501915693283
04eed24e26d9e6aaf2ca434cad20facd5feb83d0,tpami,"HyperFace: A Deep Multi-Task Learning Framework for Face Detection, Landmark Localization, Pose Estimation, and Gender Recognition",2019,https://www.semanticscholar.org/paper/04eed24e26d9e6aaf2ca434cad20facd5feb83d0,0.4513846,high,0.18802278041839598,0.44897501915693283
01b6dc20e46f51c984bba73d5cb79086f92b51d0,tpami,Visual Tracking via Dynamic Graph Learning,2017,https://www.semanticscholar.org/paper/01b6dc20e46f51c984bba73d5cb79086f92b51d0,0.4502769,high,0.18802278041839598,0.44897501915693283
782c44447a87857f5eabfc96239e0e16a9993227,tpami,Zig-Zag Network for Semantic Segmentation of RGB-D Images,2020,https://www.semanticscholar.org/paper/782c44447a87857f5eabfc96239e0e16a9993227,0.49601656,high,0.18802278041839598,0.44897501915693283
6e025a54d7002a0f56be1aed8a88bb25a7d68d7f,tpami,Joint Detection and Matching of Feature Points in Multimodal Images,2018,https://www.semanticscholar.org/paper/6e025a54d7002a0f56be1aed8a88bb25a7d68d7f,0.49700448,high,0.18802278041839598,0.44897501915693283
23cf95c9045cc003f6cd0db5d3f565964f7723bf,tpami,Transferable Time-Series Forecasting Under Causal Conditional Shift,2021,https://www.semanticscholar.org/paper/23cf95c9045cc003f6cd0db5d3f565964f7723bf,0.121981815,low,0.18802278041839598,0.44897501915693283
3c551184d7733a95dc032f74c4808c58a12f97c4,tpami,Efficient Signed Graph Sampling via Balancing & Gershgorin Disc Perfect Alignment,2022,https://www.semanticscholar.org/paper/3c551184d7733a95dc032f74c4808c58a12f97c4,0.18391132,low,0.18802278041839598,0.44897501915693283
052de58bf06815511ddf57883ec4d966dc80931e,tpami,Adversarial Attack and Defense in Deep Ranking,2021,https://www.semanticscholar.org/paper/052de58bf06815511ddf57883ec4d966dc80931e,0.15677588,low,0.18802278041839598,0.44897501915693283
5baa18624792e3286e39aadbc1f9a61d43bbed4f,tpami,On the Treatment of Optimization Problems With L1 Penalty Terms via Multiobjective Continuation,2020,https://www.semanticscholar.org/paper/5baa18624792e3286e39aadbc1f9a61d43bbed4f,0.18354997,low,0.18802278041839598,0.44897501915693283
5fed7436f4924628c1e6fb352d963549bd4d4e33,tpami,Holistic Prototype Activation for Few-Shot Segmentation,2022,https://www.semanticscholar.org/paper/5fed7436f4924628c1e6fb352d963549bd4d4e33,0.49037656,high,0.18802278041839598,0.44897501915693283
1476ebf98c198999dda49a0a6d65ea4eaceb7072,tpami,A Unified Visual Information Preservation Framework for Self-supervised Pre-Training in Medical Image Analysis,2023,https://www.semanticscholar.org/paper/1476ebf98c198999dda49a0a6d65ea4eaceb7072,0.50330186,high,0.18802278041839598,0.44897501915693283
155f9d92baa2756ee1476634904991b26890db9f,tpami,A Unified Experience Replay Framework for Spiking Deep Reinforcement Learning.,2025,https://www.semanticscholar.org/paper/155f9d92baa2756ee1476634904991b26890db9f,0.09788932,low,0.18802278041839598,0.44897501915693283
3d18bed9b29b9e1a38eac2f7f44b97d9c86d290f,tpami,Using Zodiacal Light for Spaceborne Calibration of Polarimetric Imagers,2023,https://www.semanticscholar.org/paper/3d18bed9b29b9e1a38eac2f7f44b97d9c86d290f,0.083669566,low,0.18802278041839598,0.44897501915693283
166b2b8637a064c78e4156afbb11b1baf5333429,tpami,Decentralized Federated Averaging,2021,https://www.semanticscholar.org/paper/166b2b8637a064c78e4156afbb11b1baf5333429,0.16303122,low,0.18802278041839598,0.44897501915693283
6cf72e7417dfe823940a0bc14fc95a416c07916d,tpami,Variational Label Enhancement,2020,https://www.semanticscholar.org/paper/6cf72e7417dfe823940a0bc14fc95a416c07916d,0.18737027,low,0.18802278041839598,0.44897501915693283
8a64969067c2be332fb064502df9b6d7d2e6b1e9,tpami,Unsupervised Person Re-Identification With Wireless Positioning Under Weak Scene Labeling,2021,https://www.semanticscholar.org/paper/8a64969067c2be332fb064502df9b6d7d2e6b1e9,0.45286343,high,0.18802278041839598,0.44897501915693283
40144e29bf373e6a2e484853afb8288702ded96c,tpami,Transferable Coupled Network for Zero-Shot Sketch-Based Image Retrieval,2021,https://www.semanticscholar.org/paper/40144e29bf373e6a2e484853afb8288702ded96c,0.47649336,high,0.18802278041839598,0.44897501915693283
5f8c8f072b75802f23c9ed983a5f9f51dea15173,tpami,Rate-Distortion Theory in Coding for Machines and Its Applications,2023,https://www.semanticscholar.org/paper/5f8c8f072b75802f23c9ed983a5f9f51dea15173,0.4798685,high,0.18802278041839598,0.44897501915693283
f526138513b7070aa3816c348f4ce1b77b9ea72a,tpami,Deformable Part Region Learning and Feature Aggregation Tree Representation for Object Detection,2023,https://www.semanticscholar.org/paper/f526138513b7070aa3816c348f4ce1b77b9ea72a,0.47546527,high,0.18802278041839598,0.44897501915693283
73abb9a8575d24fd9a18f538f51503478c91ace4,tpami,"A Systematic Evaluation and Benchmark for Person Re-Identification: Features, Metrics, and Datasets",2016,https://www.semanticscholar.org/paper/73abb9a8575d24fd9a18f538f51503478c91ace4,0.45802307,high,0.18802278041839598,0.44897501915693283
46b143d2bf1d173ce3c75e1da3bc8f8808689041,tpami,Improving Embedding of Graphs with Missing Data by Soft Manifolds.,2025,https://www.semanticscholar.org/paper/46b143d2bf1d173ce3c75e1da3bc8f8808689041,0.16273688,low,0.18802278041839598,0.44897501915693283
0e970971900546ddb2254a7558c60fb261fde838,tpami,Structural and Statistical Texture Knowledge Distillation and Learning for Segmentation,2025,https://www.semanticscholar.org/paper/0e970971900546ddb2254a7558c60fb261fde838,0.450052,high,0.18802278041839598,0.44897501915693283
7a584a26e15e04054c4ff16b6543ecc2bcba5fc6,tpami,FedCut: A Spectral Analysis Framework for Reliable Detection of Byzantine Colluders,2022,https://www.semanticscholar.org/paper/7a584a26e15e04054c4ff16b6543ecc2bcba5fc6,0.12971562,low,0.18802278041839598,0.44897501915693283
f05027330935f391272545239dfe6fc7e87a63c3,tpami,MINN: Learning the Dynamics of Differential-Algebraic Equations and Application to Battery Modeling,2023,https://www.semanticscholar.org/paper/f05027330935f391272545239dfe6fc7e87a63c3,0.1735011,low,0.18802278041839598,0.44897501915693283
5a3e3b22c30b53c03f46805b3f20980b6376a2ef,tpami,Recognising Planes in a Single Image,2015,https://www.semanticscholar.org/paper/5a3e3b22c30b53c03f46805b3f20980b6376a2ef,0.46638077,high,0.18802278041839598,0.44897501915693283
56e07ee8e0d3be5be706e6c15a106df0daa3c5b4,tpami,Iteratively Capped Reweighting Norm Minimization With Global Convergence Guarantee for Low-Rank Matrix Learning,2024,https://www.semanticscholar.org/paper/56e07ee8e0d3be5be706e6c15a106df0daa3c5b4,0.16281322,low,0.18802278041839598,0.44897501915693283
a7d2c6d88946c90673a31df10884a8d7c8033db2,tpami,Efficient Learning-Free Keyword Spotting,2019,https://www.semanticscholar.org/paper/a7d2c6d88946c90673a31df10884a8d7c8033db2,0.5872051,high,0.18802278041839598,0.44897501915693283
62e74385506632a1ae5aebde0d92aa4aa5270e3b,tpami,Defensive Few-Shot Learning,2019,https://www.semanticscholar.org/paper/62e74385506632a1ae5aebde0d92aa4aa5270e3b,0.17570657,low,0.18802278041839598,0.44897501915693283
a36563b9dba608adce3f1e4d077b4dd53c27d89c,tpami,Person Re-Identification With Deep Kronecker-Product Matching and Group-Shuffling Random Walk,2019,https://www.semanticscholar.org/paper/a36563b9dba608adce3f1e4d077b4dd53c27d89c,0.5073123,high,0.18802278041839598,0.44897501915693283
ce030eaad34cc4aa8abfec6168f0b68062a07852,tpami,Understanding and Mitigating Dimensional Collapse in Federated Learning,2024,https://www.semanticscholar.org/paper/ce030eaad34cc4aa8abfec6168f0b68062a07852,0.17520769,low,0.18802278041839598,0.44897501915693283
a4aaf1e05ed829c0ad03eaf543208b6761271f69,tpami,Liquid Warping GAN With Attention: A Unified Framework for Human Image Synthesis,2020,https://www.semanticscholar.org/paper/a4aaf1e05ed829c0ad03eaf543208b6761271f69,0.45304826,high,0.18802278041839598,0.44897501915693283
9c67afd2a24c894717953c9898b40cce52751e37,tpami,DaisyRec 2.0: Benchmarking Recommendation for Rigorous Evaluation,2022,https://www.semanticscholar.org/paper/9c67afd2a24c894717953c9898b40cce52751e37,0.14849527,low,0.18802278041839598,0.44897501915693283
